{
  "$schema": "https://json-schema.org/draft/2020-12/schema",
  "$id": "https://schemas.runx.ai/runx/security/exact-cve-delivery/v1.json",
  "x-runx-packet-id": "runx.security.exact_cve_delivery.v1",
  "type": "object",
  "required": ["schema", "created_at", "target", "dependency_scope", "result", "verification", "artifacts", "delivery_digest"],
  "properties": {
    "schema": { "const": "runx.security.exact_cve_delivery.v1" },
    "created_at": { "type": "string", "minLength": 1 },
    "target": { "type": "object", "additionalProperties": true },
    "dependency_scope": { "enum": ["direct-production", "all-installed"] },
    "result": { "type": "object", "additionalProperties": true },
    "verification": {
      "type": "object",
      "required": ["verified", "false_hits", "missing_hits", "exact_dependencies_replayed", "verified_findings"],
      "properties": {
        "verified": { "const": true },
        "false_hits": { "type": "integer", "minimum": 0 },
        "missing_hits": { "type": "integer", "minimum": 0 },
        "exact_dependencies_replayed": { "type": "integer", "minimum": 0 },
        "verified_findings": { "type": "integer", "minimum": 0 }
      },
      "additionalProperties": true
    },
    "artifacts": {
      "type": "object",
      "required": ["report", "evidence", "audit_result", "verification"],
      "properties": {
        "report": { "$ref": "#/$defs/artifact" },
        "evidence": { "$ref": "#/$defs/artifact" },
        "audit_result": { "$ref": "#/$defs/artifact" },
        "verification": { "$ref": "#/$defs/artifact" }
      },
      "additionalProperties": true
    },
    "delivery_digest": { "type": "string", "pattern": "^sha256:[0-9a-f]{64}$" },
    "artifact": { "$ref": "#/$defs/artifact" }
  },
  "$defs": {
    "artifact": {
      "type": "object",
      "required": ["path", "sha256"],
      "properties": {
        "path": { "type": "string", "minLength": 1 },
        "sha256": { "type": "string", "pattern": "^[0-9a-f]{64}$" }
      },
      "additionalProperties": true
    }
  },
  "additionalProperties": true
}
