{
  "schema": "runx.security.exact_cve_delivery.v1",
  "created_at": "2026-07-15T00:46:18.707Z",
  "target": {
    "commit": "c5cb68a7084e4ae7dcc60e6a98768720a81841e8",
    "lockfile_sha256": "b9ed49893a9d3bcf6fe567cd38fe8168850591e0018f19d3bb0d1f80a4c2eecc",
    "lockfile_url": "https://raw.githubusercontent.com/OWASP/NodeGoat/c5cb68a7084e4ae7dcc60e6a98768720a81841e8/package-lock.json",
    "lockfile_version": 2,
    "name": "OWASP NodeGoat",
    "repo": "https://github.com/OWASP/NodeGoat"
  },
  "dependency_scope": "direct-production",
  "result": {
    "advisory_findings": 13,
    "affected_dependencies": 6,
    "exact_dependencies_queried": 16,
    "source": "OSV",
    "source_url": "https://api.osv.dev"
  },
  "verification": {
    "verified": true,
    "false_hits": 0,
    "missing_hits": 0,
    "exact_dependencies_replayed": 16,
    "verified_findings": 13
  },
  "artifacts": {
    "report": {
      "bytes": 3991,
      "path": "artifacts/report.md",
      "sha256": "5067e9d56746620aeb49e1289a696271f85bc5fea5e6989972b531f6a792bcf8"
    },
    "evidence": {
      "bytes": 10313,
      "path": "artifacts/evidence.json",
      "sha256": "e28279b6d62c07c93f6a3531592d79a6bb681c32122dce2cf954cbe88e83cc49"
    },
    "audit_result": {
      "bytes": 23036,
      "path": "artifacts/audit-result.json",
      "sha256": "f9be6c0e424af8b4a7b36bdbb9bf43790225a8c78f818c5ba7997932dde49e1f"
    },
    "verification": {
      "bytes": 4461,
      "path": "artifacts/verification.json",
      "sha256": "3e0ad09ffd59d102702e0a485e8eb9f361f0c50be6079b3e97c0f6611f276795"
    }
  },
  "delivery_digest": "sha256:f76c5a92824d19050a6a2c01fd042db835ec30642177227926da4e7d6415e2ab"
}
